{
  "specversion": "mctl.events/v1",
  "id": "github:5b2f7a40-9384-11f1-8a0e-2c6d1a7f0b11",
  "type": "github.pull_request.synchronize",
  "source": "mctl-api",
  "occurred_at": "2026-09-17T08:05:12+00:00",
  "correlation_id": "github:5b2f7a40-9384-11f1-8a0e-2c6d1a7f0b11",
  "subject": {
    "kind": "github.pull_request",
    "repository": "mctlhq/.github",
    "number": "89",
    "head_sha": "3e737a5d7c1f0f8f5c9a2b64a1e0d9c2b7f41a0e"
  }
}
